{
  "schemaVersion": 1,
  "kind": "ls11-release-scope",
  "packetId": "LS-11",
  "githubIssue": 361,
  "base": {
    "repository": "linktrend/LiNKsites",
    "ref": "development",
    "commit": "02ebf5d8710c50c1f2c390989239f0baf916ba97",
    "tree": "fb427d30ea7c3e7060fc9cc1a63a1110266dd755"
  },
  "ownedPaths": [
    "docs/evidence/profile-v2-release/**",
    "docs/releases/**"
  ],
  "prohibitedPrefixes": [
    "packages/",
    "apps/",
    "deploy/",
    "execution/",
    "config/",
    "supabase/",
    "infra/",
    "tests/",
    "scripts/",
    ".github/"
  ],
  "productRuntimeConfigProviderHarnessEdits": false,
  "promotion": false
}
